{
  "schema_version": "market-impact.evidence-pack.v1",
  "event_id": "masked-physical-supply-case-a",
  "as_of": "2031-05-10T23:59:59Z",
  "research_question": "After the frozen recovery and shipment evidence became visible, should the eligible integrated upstream public-equity target still be proposed up for one trading session, or should the analysis abstain?",
  "evidence": [
    {
      "evidence_id": "pre-event-balance",
      "claim_id": "pre-event-operations-normal",
      "source_ref": "masked://official/pre-event-balance",
      "source_tier": "official",
      "available_at": "2031-05-03T23:59:59Z",
      "content_hash": "19de2d664ceb62dce2f614a2c841b7f23cff1cf4b86a2645828b841db7d216e3",
      "summary": "Pre-event official balance indicated broadly normal supply conditions.",
      "untrusted_text": true
    },
    {
      "evidence_id": "physical-loss",
      "claim_id": "material-production-suspension",
      "source_ref": "masked://primary/operator-loss-confirmation",
      "source_tier": "primary",
      "available_at": "2031-05-06T23:59:59Z",
      "content_hash": "2da6eb8a63b36b62d057b5d95d1720ba04d3c5f9077ca94d8eafeeabc81a4ba4",
      "summary": "Primary operator confirmed a globally material production suspension.",
      "untrusted_text": true
    },
    {
      "evidence_id": "restoration-update",
      "claim_id": "rapid-restoration-guidance",
      "source_ref": "masked://primary/operator-restoration-update",
      "source_tier": "primary",
      "available_at": "2031-05-09T23:59:59Z",
      "content_hash": "6d71c6271b34624343e54948d0b280794cc310f1bf911514bfa2151ac521ee47",
      "summary": "Operator reported substantial recovery and short-horizon restoration guidance.",
      "untrusted_text": true
    },
    {
      "evidence_id": "shipment-mitigation",
      "claim_id": "customer-shipments-maintained",
      "source_ref": "masked://primary/operator-shipment-update",
      "source_tier": "primary",
      "available_at": "2031-05-09T23:59:59Z",
      "content_hash": "693dccab302bfaf289c71f3a697b1c82ca4ee3972ff6ba057f586f919be7f60d",
      "summary": "Inventories and substitute production mitigated near-term delivery disruption.",
      "untrusted_text": true
    },
    {
      "evidence_id": "target-mapping",
      "claim_id": "integrated-upstream-exposure",
      "source_ref": "masked://primary/issuer-pre-event-filing",
      "source_tier": "primary",
      "available_at": "2030-11-20T00:00:00Z",
      "content_hash": "b09607ebb1b729c10c79ca161956ae02d970af9f2020d49c0411fae37a0d7081",
      "summary": "Pre-event filing maps both upstream exposure and integrated-business offsets.",
      "untrusted_text": true
    }
  ],
  "pattern_packs": [
    {
      "pack_id": "pattern-0cafee00e9e035db87be8867dff9798478730b701a2869e31ea9dd886d09083c",
      "version": "opened-development-physical-energy-v1",
      "available_at": "2030-08-23T00:00:00Z",
      "content_hash": "813fda6c745a96199dc37af040f4c203b5d6f161fdb62e9f78c976e6b00e3413"
    }
  ],
  "allowed_targets": ["integrated-upstream-a"],
  "data_gaps": [
    "a regulated benchmark settlement visible before entry is unavailable",
    "target-specific immediate segment sensitivity is unavailable",
    "restoration guidance has not yet been independently verified at the cutoff"
  ],
  "pack_id": "evidence-pack-8237a6b8f8b58884df56922dc81ceebfbabdbb0b953c48c1de46ec14cabbe615"
}
